{
  "schema": "fmea-mining.complementary-discrimination.v1",
  "version": "1.3.10",
  "purpose": "Cruzar duas hipoteses alternativas com dois testes complementares de cada P0, identificando lacunas de poder discriminante.",
  "policy": {
    "allHypothesesRemainOpen": true,
    "technicalReviewRequired": true,
    "autoExclusionAllowed": false,
    "numericalConfidenceAllowed": false,
    "manualEffectivityRequired": true,
    "onlyInferPotential": false
  },
  "values": [
    "nao_discrimina",
    "indicio_parcial",
    "potencialmente_discriminante_condicional"
  ],
  "counts": {
    "baseTests": 6,
    "alternativeHypotheses": 12,
    "complementAssessments": 24,
    "unresolvedGaps": 12
  },
  "records": [
    {
      "id": "XREF-FC-HOSE-001-ALT1",
      "testId": "DISC-FC-HOSE-001-I1",
      "chainId": "FC-HOSE-001",
      "alternativeHypothesisId": "ALT1",
      "alternativeDescription": "Vazamento na união/conexão sem desgaste estrutural do tubo",
      "complementAssessments": [
        {
          "complementaryMethodId": "EV-15",
          "discriminativeValue": "indicio_parcial",
          "potentialSupport": "Roteamento/cargas de contato podem explicar abrasão, mas não estabelecem se o terminal é origem de fuga.",
          "potentialWeakening": "Folgas e posição compatíveis reduzem suspeita de atrito, sem excluir defeito de terminal.",
          "remainingAmbiguity": "Roteamento pode estar incorreto e conexão vazar simultaneamente.",
          "performed": false,
          "oemEffective": false,
          "isolationProof": false
        },
        {
          "complementaryMethodId": "EV-13",
          "discriminativeValue": "nao_discrimina",
          "potentialSupport": "Histórico de montagem ou troca do terminal ajuda a formular hipótese, mas não localiza a fuga atual.",
          "potentialWeakening": "Histórico sem intervenções não afasta falha de terminal.",
          "remainingAmbiguity": "Ausência de relato não é evidência da estanqueidade. A interpretação isolada não permite excluir mecanismo concorrente sem referência OEM e prova independente.",
          "performed": false,
          "oemEffective": false,
          "isolationProof": false
        }
      ],
      "remainingGap": {
        "methodId": "EV-01",
        "neededInvestigation": "Inspeção localizada da origem da trilha, com sistema isolado e sem contato com fluido pressurizado, distinguindo terminal de cobertura.",
        "unresolvedReason": "sem_resultado_ou_origem_rastreada",
        "status": "pendente"
      },
      "closureRule": "A ausência de verificação independente e OEM específico impede descartar qualquer hipótese concorrente.",
      "reviews": {
        "mechanical": "pending",
        "oem": "pending",
        "evidence": "not_collected"
      },
      "confirmedRootCause": false,
      "claimStatus": "proposta_de_discriminacao_sem_resultado_empirico"
    },
    {
      "id": "XREF-FC-HOSE-001-ALT2",
      "testId": "DISC-FC-HOSE-001-I1",
      "chainId": "FC-HOSE-001",
      "alternativeHypothesisId": "ALT2",
      "alternativeDescription": "Óleo proveniente de outro ponto escorre sobre a mangueira",
      "complementAssessments": [
        {
          "complementaryMethodId": "EV-15",
          "discriminativeValue": "nao_discrimina",
          "potentialSupport": "Inspeção de folga e suporte não demonstra de onde o óleo escorreu.",
          "potentialWeakening": "Trajeto correto não exclui vazamento acima da mangueira.",
          "remainingAmbiguity": "Traçado de uma mangueira não é traçado de fluido. A interpretação isolada não permite excluir mecanismo concorrente sem referência OEM e prova independente.",
          "performed": false,
          "oemEffective": false,
          "isolationProof": false
        },
        {
          "complementaryMethodId": "EV-13",
          "discriminativeValue": "indicio_parcial",
          "potentialSupport": "Histórico de fuga em conjunto superior ajuda a priorizar a investigação.",
          "potentialWeakening": "Ausência de evento anterior não exclui fuga nova. Isso reduz apenas a plausibilidade na condição examinada, sem eliminar falha intermitente nem outra origem.",
          "remainingAmbiguity": "Histórico pode estar incompleto e não registra vazamento atual.",
          "performed": false,
          "oemEffective": false,
          "isolationProof": false
        }
      ],
      "remainingGap": {
        "methodId": "EV-01",
        "neededInvestigation": "Rastrear origem física da trilha e examinar componentes posicionados acima da linha, em condição segura.",
        "unresolvedReason": "origem_de_fluidos_nao_localizada",
        "status": "pendente"
      },
      "closureRule": "A ausência de verificação independente e OEM específico impede descartar qualquer hipótese concorrente.",
      "reviews": {
        "mechanical": "pending",
        "oem": "pending",
        "evidence": "not_collected"
      },
      "confirmedRootCause": false,
      "claimStatus": "proposta_de_discriminacao_sem_resultado_empirico"
    },
    {
      "id": "XREF-FC-FD-001-ALT1",
      "testId": "DISC-FC-FD-001-I2",
      "chainId": "FC-FD-001",
      "alternativeHypothesisId": "ALT1",
      "alternativeDescription": "Desgaste de regime/assentamento sem falha evolutiva comprovada",
      "complementAssessments": [
        {
          "complementaryMethodId": "EV-11",
          "discriminativeValue": "indicio_parcial",
          "potentialSupport": "Depósito fino, morfologia estável e histórico coerente são compatíveis com desgaste de regime.",
          "potentialWeakening": "Fragmentos grosseiros ou tendência evolutiva enfraquecem a hipótese de estabilidade.",
          "remainingAmbiguity": "Morfologia não identifica necessariamente mecanismo único e depende de coleta representativa.",
          "performed": false,
          "oemEffective": false,
          "isolationProof": false
        },
        {
          "complementaryMethodId": "EV-10",
          "discriminativeValue": "nao_discrimina",
          "potentialSupport": "Análise de água pode identificar contaminante concorrente, mas não define se partículas metálicas decorrem de assentamento.",
          "potentialWeakening": "Resultado sem água não demonstra ausência de desgaste. Isso reduz apenas a plausibilidade na condição examinada, sem eliminar falha intermitente nem outra origem.",
          "remainingAmbiguity": "Teste de água e análise de partículas medem propriedades diferentes.",
          "performed": false,
          "oemEffective": false,
          "isolationProof": false
        }
      ],
      "remainingGap": {
        "methodId": "EV-13",
        "neededInvestigation": "Reconstruir série histórica por compartimento, mudança de óleo, manutenção e horas de uso em condições comparáveis.",
        "unresolvedReason": "serie_historica_comparavel_ausente",
        "status": "pendente"
      },
      "closureRule": "A ausência de verificação independente e OEM específico impede descartar qualquer hipótese concorrente.",
      "reviews": {
        "mechanical": "pending",
        "oem": "pending",
        "evidence": "not_collected"
      },
      "confirmedRootCause": false,
      "claimStatus": "proposta_de_discriminacao_sem_resultado_empirico"
    },
    {
      "id": "XREF-FC-FD-001-ALT2",
      "testId": "DISC-FC-FD-001-I2",
      "chainId": "FC-FD-001",
      "alternativeHypothesisId": "ALT2",
      "alternativeDescription": "Partículas produzidas por falha já existente de engrenagem/rolamento",
      "complementAssessments": [
        {
          "complementaryMethodId": "EV-11",
          "discriminativeValue": "potencialmente_discriminante_condicional",
          "potentialSupport": "Morfologia grosseira ou fragmentos de desgaste pode apoiar geração interna se a origem externa for controlada.",
          "potentialWeakening": "Somente depósito estável e fino enfraquece dano interno progressivo naquele período.",
          "remainingAmbiguity": "Bujão magnético não diferencia com certeza rolamento, engrenagem ou partícula de manutenção.",
          "performed": false,
          "oemEffective": false,
          "isolationProof": false
        },
        {
          "complementaryMethodId": "EV-10",
          "discriminativeValue": "indicio_parcial",
          "potentialSupport": "Água detectada reforça risco de ingresso/degradação, sem localizar fonte de partículas metálicas.",
          "potentialWeakening": "Água ausente reduz apenas uma rota de contaminação. Isso reduz apenas a plausibilidade na condição examinada, sem eliminar falha intermitente nem outra origem.",
          "remainingAmbiguity": "Partículas metálicas podem surgir sem água. A interpretação isolada não permite excluir mecanismo concorrente sem referência OEM e prova independente.",
          "performed": false,
          "oemEffective": false,
          "isolationProof": false
        }
      ],
      "remainingGap": {
        "methodId": "EV-12",
        "neededInvestigation": "Inspeção técnica dirigida à condição da engrenagem/rolamento conforme OEM, somente quando tecnicamente indicada e segura.",
        "unresolvedReason": "origem_de_particulas_nao_comprovada",
        "status": "pendente"
      },
      "closureRule": "A ausência de verificação independente e OEM específico impede descartar qualquer hipótese concorrente.",
      "reviews": {
        "mechanical": "pending",
        "oem": "pending",
        "evidence": "not_collected"
      },
      "confirmedRootCause": false,
      "claimStatus": "proposta_de_discriminacao_sem_resultado_empirico"
    },
    {
      "id": "XREF-FC-COOL-001-ALT1",
      "testId": "DISC-FC-COOL-001-I1",
      "chainId": "FC-COOL-001",
      "alternativeHypothesisId": "ALT1",
      "alternativeDescription": "Baixo nível ou circulação deficiente de líquido de arrefecimento",
      "complementAssessments": [
        {
          "complementaryMethodId": "EV-14",